{
  "chapter_index": 5,
  "section_id": "## 5. Decision Point and Path Forward",
  "directive_count": 1,
  "hints": [
    {
      "directive_type": "problem",
      "label": "prob-gemini-collaboration-tasks",
      "title": "Critical Tasks for Gemini Collaboration",
      "start_line": 585,
      "end_line": 597,
      "header_lines": [
        586
      ],
      "content_start": 588,
      "content_end": 596,
      "content": "588: :label: prob-gemini-collaboration-tasks\n589: \n590: 1. **Refine the two-state counterexample**: Develop a rigorous lower-dimensional model where calculations are exact. Determine precisely when KL-non-expansiveness holds.\n591: \n592: 2. **Investigate joint operator**: Instead of analyzing $\\mathcal{R}$ alone, study the composed operator $\\mathcal{J} = $ (killing + revival). Does the killing term compensate for revival's entropy increase?\n593: \n594: 3. **Explore alternative formulations**: Can we reformulate the revival operator to make KL-properties more transparent? E.g., as a Bayesian update with explicit noise?\n595: \n596: 4. **Check literature**: Has anyone studied KL-properties of proportional resampling operators in McKean-Vlasov systems? Search for related results in QSD theory, population dynamics, branching processes.",
      "metadata": {
        "label": "prob-gemini-collaboration-tasks"
      },
      "section": "## 5. Decision Point and Path Forward",
      "raw_directive": "585: Based on these preliminary findings, I recommend the following investigations with Gemini:\n586: \n587: :::{prf:problem} Critical Tasks for Gemini Collaboration\n588: :label: prob-gemini-collaboration-tasks\n589: \n590: 1. **Refine the two-state counterexample**: Develop a rigorous lower-dimensional model where calculations are exact. Determine precisely when KL-non-expansiveness holds.\n591: \n592: 2. **Investigate joint operator**: Instead of analyzing $\\mathcal{R}$ alone, study the composed operator $\\mathcal{J} = $ (killing + revival). Does the killing term compensate for revival's entropy increase?\n593: \n594: 3. **Explore alternative formulations**: Can we reformulate the revival operator to make KL-properties more transparent? E.g., as a Bayesian update with explicit noise?\n595: \n596: 4. **Check literature**: Has anyone studied KL-properties of proportional resampling operators in McKean-Vlasov systems? Search for related results in QSD theory, population dynamics, branching processes.\n597: "
    }
  ],
  "validation": {
    "ok": true,
    "errors": []
  }
}