{
  "chapter_index": 10,
  "section_id": "## 5. Decision Point and Path Forward",
  "directive_count": 1,
  "hints": [
    {
      "directive_type": "problem",
      "label": "prob-gemini-collaboration-tasks",
      "title": "Critical Tasks for Gemini Collaboration",
      "start_line": 1155,
      "end_line": 1167,
      "header_lines": [
        1156
      ],
      "content_start": 1158,
      "content_end": 1166,
      "content": "1158: :label: prob-gemini-collaboration-tasks\n1159: \n1160: 1. **Refine the two-state counterexample**: Develop a rigorous lower-dimensional model where calculations are exact. Determine precisely when KL-non-expansiveness holds.\n1161: \n1162: 2. **Investigate joint operator**: Instead of analyzing $\\mathcal{R}$ alone, study the composed operator $\\mathcal{J} = $ (killing + revival). Does the killing term compensate for revival's entropy increase?\n1163: \n1164: 3. **Explore alternative formulations**: Can we reformulate the revival operator to make KL-properties more transparent? E.g., as a Bayesian update with explicit noise?\n1165: \n1166: 4. **Check literature**: Has anyone studied KL-properties of proportional resampling operators in McKean-Vlasov systems? Search for related results in QSD theory, population dynamics, branching processes.",
      "metadata": {
        "label": "prob-gemini-collaboration-tasks"
      },
      "section": "## 5. Decision Point and Path Forward",
      "references": [],
      "raw_directive": "1155: Based on these preliminary findings, I recommend the following investigations with Gemini:\n1156: \n1157: :::{prf:problem} Critical Tasks for Gemini Collaboration\n1158: :label: prob-gemini-collaboration-tasks\n1159: \n1160: 1. **Refine the two-state counterexample**: Develop a rigorous lower-dimensional model where calculations are exact. Determine precisely when KL-non-expansiveness holds.\n1161: \n1162: 2. **Investigate joint operator**: Instead of analyzing $\\mathcal{R}$ alone, study the composed operator $\\mathcal{J} = $ (killing + revival). Does the killing term compensate for revival's entropy increase?\n1163: \n1164: 3. **Explore alternative formulations**: Can we reformulate the revival operator to make KL-properties more transparent? E.g., as a Bayesian update with explicit noise?\n1165: \n1166: 4. **Check literature**: Has anyone studied KL-properties of proportional resampling operators in McKean-Vlasov systems? Search for related results in QSD theory, population dynamics, branching processes.\n1167: "
    }
  ],
  "validation": {
    "ok": true,
    "errors": []
  }
}