{
  "chapter_index": 22,
  "section_id": "## 13. Main Theorem: Complete Statement",
  "directive_count": 2,
  "hints": [
    {
      "directive_type": "theorem",
      "label": "thm-main-complete-cinf-geometric-gas-full",
      "title": "C^\u221e Regularity of Geometric Gas with Companion-Dependent Fitness (Complete)",
      "start_line": 4782,
      "end_line": 4849,
      "header_lines": [
        4783
      ],
      "content_start": 4785,
      "content_end": 4848,
      "content": "4785: :label: thm-main-complete-cinf-geometric-gas-full\n4786: \n4787: Consider the Geometric Gas algorithm with **regularized** companion-dependent measurements:\n4788: \n4789: $$\n4790: d_j = d_{\\text{alg}}(j, c(j)) = \\sqrt{\\|x_j - x_{c(j)}\\|^2 + \\lambda_{\\text{alg}} \\|v_j - v_{c(j)}\\|^2 + \\varepsilon_d^2}\n4791: \n4792: $$\n4793: \n4794: where:\n4795: - $\\varepsilon_d > 0$ is the **distance regularization parameter** (eliminates singularity at walker collisions)\n4796: - Companions $c(j) \\in \\mathcal{A} \\setminus \\{j\\}$ are selected via softmax:\n4797: \n4798: $$\n4799: \\mathbb{P}(c(j) = \\ell) = \\frac{\\exp(-d_{\\text{alg}}^2(j,\\ell)/(2\\varepsilon_c^2))}{\\sum_{\\ell' \\in \\mathcal{A} \\setminus \\{j\\}} \\exp(-d_{\\text{alg}}^2(j,\\ell')/(2\\varepsilon_c^2))}\n4800: \n4801: $$\n4802: \n4803: Under the framework assumptions:\n4804: - {prf:ref}`lem-companion-availability-enforcement` (minimum companion within $\\mathcal{O}(\\varepsilon_c)$)\n4805: - {prf:ref}`assump-uniform-density-full` (bounded phase-space density)\n4806: - {prf:ref}`assump-rescale-function-cinf-full` (C^\u221e rescale function)\n4807: \n4808: The **complete fitness potential**:\n4809: \n4810: $$\n4811: V_{\\text{fit}}(x_i, v_i) = g_A\\left(\\frac{d_i - \\mu_\\rho^{(i)}}{\\sigma'_\\rho(i)}\\right)\n4812: \n4813: $$\n4814: \n4815: where:\n4816: - $\\mu_\\rho^{(i)} = \\sum_{j} w_{ij}(\\rho) d_j$ (localized mean)\n4817: - $\\sigma'_\\rho(i) = \\sqrt{\\sum_j w_{ij}(\\rho)(d_j - \\mu_\\rho)^2 + \\eta_{\\min}^2}$ (regularized std dev)\n4818: - $w_{ij}(\\rho) = \\exp(-d_{\\text{alg}}^2(i,j)/(2\\rho^2)) / Z_i(\\rho)$ (localization weights)\n4819: \n4820: is **infinitely differentiable** (C^\u221e) with respect to $(x_i, v_i)$ for all walkers $i \\in \\mathcal{A}$.\n4821: \n4822: **Derivative Bounds**: For all $m \\geq 1$:\n4823: \n4824: $$\n4825: \\|\\nabla^m V_{\\text{fit}}\\|_\\infty \\leq C_{V,m}(d, \\rho, \\varepsilon_c, \\varepsilon_d, \\eta_{\\min}) \\cdot \\max(\\rho^{-m}, \\varepsilon_d^{1-m})\n4826: \n4827: $$\n4828: \n4829: For typical parameters where $\\varepsilon_d \\ll \\rho \\sim \\varepsilon_c$ and $m \\geq 2$, the $\\varepsilon_d^{1-m}$ term dominates, making **distance regularization the bottleneck** for high-order derivative bounds. This is because the $\\varepsilon_d$ dependence propagates from companion measurements through the entire fitness pipeline (see \u00a712.3.2 for the complete dependency chain).\n4830: \n4831: where the constant:\n4832: \n4833: $$\n4834: C_{V,m}(d, \\rho, \\varepsilon_c, \\varepsilon_d, \\eta_{\\min}) = \\mathcal{O}(m! \\cdot d^m \\cdot \\rho^{2dm} \\cdot \\varepsilon_d^{-(m-1)} \\cdot \\eta_{\\min}^{-(2m+1)})\n4835: \n4836: $$\n4837: \n4838: exhibits:\n4839: - **Factorial growth** in derivative order $m$ (Gevrey-1)\n4840: - **Polynomial growth** in dimension $d$ (explicit tracking)\n4841: - **Inverse scaling** with regularization parameters $\\varepsilon_d$, $\\eta_{\\min}$ (uniform bounds)\n4842: - **Polynomial growth** in localization scale $\\rho^{2dm}$ (exponential locality)\n4843: \n4844: The constant is **independent of** (uniformity properties):\n4845: 1. Total swarm size $N$ (N-uniformity: bounds do not grow with total swarm population)\n4846: 2. Number of alive walkers $k = |\\mathcal{A}|$ (k-uniformity: independent of how many walkers remain alive)\n4847: 3. Walker index $i$ (permutation invariance: all walkers treated symmetrically)\n4848: 4. Walker configurations (uniform over state space: bounds hold regardless of walker positions)",
      "metadata": {
        "label": "thm-main-complete-cinf-geometric-gas-full"
      },
      "section": "## 13. Main Theorem: Complete Statement",
      "raw_directive": "4782: We now state the complete main theorem, synthesizing all previous results.\n4783: \n4784: :::{prf:theorem} C^\u221e Regularity of Geometric Gas with Companion-Dependent Fitness (Complete)\n4785: :label: thm-main-complete-cinf-geometric-gas-full\n4786: \n4787: Consider the Geometric Gas algorithm with **regularized** companion-dependent measurements:\n4788: \n4789: $$\n4790: d_j = d_{\\text{alg}}(j, c(j)) = \\sqrt{\\|x_j - x_{c(j)}\\|^2 + \\lambda_{\\text{alg}} \\|v_j - v_{c(j)}\\|^2 + \\varepsilon_d^2}\n4791: \n4792: $$\n4793: \n4794: where:\n4795: - $\\varepsilon_d > 0$ is the **distance regularization parameter** (eliminates singularity at walker collisions)\n4796: - Companions $c(j) \\in \\mathcal{A} \\setminus \\{j\\}$ are selected via softmax:\n4797: \n4798: $$\n4799: \\mathbb{P}(c(j) = \\ell) = \\frac{\\exp(-d_{\\text{alg}}^2(j,\\ell)/(2\\varepsilon_c^2))}{\\sum_{\\ell' \\in \\mathcal{A} \\setminus \\{j\\}} \\exp(-d_{\\text{alg}}^2(j,\\ell')/(2\\varepsilon_c^2))}\n4800: \n4801: $$\n4802: \n4803: Under the framework assumptions:\n4804: - {prf:ref}`lem-companion-availability-enforcement` (minimum companion within $\\mathcal{O}(\\varepsilon_c)$)\n4805: - {prf:ref}`assump-uniform-density-full` (bounded phase-space density)\n4806: - {prf:ref}`assump-rescale-function-cinf-full` (C^\u221e rescale function)\n4807: \n4808: The **complete fitness potential**:\n4809: \n4810: $$\n4811: V_{\\text{fit}}(x_i, v_i) = g_A\\left(\\frac{d_i - \\mu_\\rho^{(i)}}{\\sigma'_\\rho(i)}\\right)\n4812: \n4813: $$\n4814: \n4815: where:\n4816: - $\\mu_\\rho^{(i)} = \\sum_{j} w_{ij}(\\rho) d_j$ (localized mean)\n4817: - $\\sigma'_\\rho(i) = \\sqrt{\\sum_j w_{ij}(\\rho)(d_j - \\mu_\\rho)^2 + \\eta_{\\min}^2}$ (regularized std dev)\n4818: - $w_{ij}(\\rho) = \\exp(-d_{\\text{alg}}^2(i,j)/(2\\rho^2)) / Z_i(\\rho)$ (localization weights)\n4819: \n4820: is **infinitely differentiable** (C^\u221e) with respect to $(x_i, v_i)$ for all walkers $i \\in \\mathcal{A}$.\n4821: \n4822: **Derivative Bounds**: For all $m \\geq 1$:\n4823: \n4824: $$\n4825: \\|\\nabla^m V_{\\text{fit}}\\|_\\infty \\leq C_{V,m}(d, \\rho, \\varepsilon_c, \\varepsilon_d, \\eta_{\\min}) \\cdot \\max(\\rho^{-m}, \\varepsilon_d^{1-m})\n4826: \n4827: $$\n4828: \n4829: For typical parameters where $\\varepsilon_d \\ll \\rho \\sim \\varepsilon_c$ and $m \\geq 2$, the $\\varepsilon_d^{1-m}$ term dominates, making **distance regularization the bottleneck** for high-order derivative bounds. This is because the $\\varepsilon_d$ dependence propagates from companion measurements through the entire fitness pipeline (see \u00a712.3.2 for the complete dependency chain).\n4830: \n4831: where the constant:\n4832: \n4833: $$\n4834: C_{V,m}(d, \\rho, \\varepsilon_c, \\varepsilon_d, \\eta_{\\min}) = \\mathcal{O}(m! \\cdot d^m \\cdot \\rho^{2dm} \\cdot \\varepsilon_d^{-(m-1)} \\cdot \\eta_{\\min}^{-(2m+1)})\n4835: \n4836: $$\n4837: \n4838: exhibits:\n4839: - **Factorial growth** in derivative order $m$ (Gevrey-1)\n4840: - **Polynomial growth** in dimension $d$ (explicit tracking)\n4841: - **Inverse scaling** with regularization parameters $\\varepsilon_d$, $\\eta_{\\min}$ (uniform bounds)\n4842: - **Polynomial growth** in localization scale $\\rho^{2dm}$ (exponential locality)\n4843: \n4844: The constant is **independent of** (uniformity properties):\n4845: 1. Total swarm size $N$ (N-uniformity: bounds do not grow with total swarm population)\n4846: 2. Number of alive walkers $k = |\\mathcal{A}|$ (k-uniformity: independent of how many walkers remain alive)\n4847: 3. Walker index $i$ (permutation invariance: all walkers treated symmetrically)\n4848: 4. Walker configurations (uniform over state space: bounds hold regardless of walker positions)\n4849: "
    },
    {
      "directive_type": "proof",
      "label": "unlabeled-proof-72",
      "title": null,
      "start_line": 4851,
      "end_line": 4882,
      "header_lines": [],
      "content_start": 4852,
      "content_end": 4881,
      "content": "4852: \n4853: :::{prf:proof}\n4854: **Summary of proof architecture**:\n4855: \n4856: 1. **Part I (\u00a72-4)**: Smooth clustering framework\n4857:    - Partition of unity construction ({prf:ref}`const-mollified-partition-full`)\n4858:    - Exponential locality ({prf:ref}`lem-softmax-tail-corrected-full`)\n4859:    - Effective interactions ({prf:ref}`lem-effective-companion-count-corrected-full`)\n4860:    - Derivative bounds for $d_{\\text{alg}}$ ({prf:ref}`lem-dalg-derivative-bounds-full`)\n4861: \n4862: 2. **Part II (\u00a75-6)**: Localization weights\n4863:    - Gaussian kernel derivatives ({prf:ref}`lem-gaussian-kernel-derivatives-full`)\n4864:    - Quotient rule for weights ({prf:ref}`lem-localization-weight-derivatives-full`)\n4865:    - Telescoping identity ({prf:ref}`lem-telescoping-localization-weights-full`)\n4866:    - Companion coupling analysis ({prf:ref}`lem-derivatives-companion-distance-full`)\n4867: \n4868: 3. **Part III (\u00a77-8)**: Localized moments\n4869:    - Localized mean inductive bounds ({prf:ref}`lem-mth-derivative-localized-mean-full`)\n4870:    - Localized variance inductive bounds ({prf:ref}`thm-mth-derivative-localized-variance-full`)\n4871:    - k-uniformity via telescoping and exponential localization\n4872: \n4873: 4. **Part IV (\u00a79-10)**: Regularization and Z-score\n4874:    - Regularized std dev with positive lower bound ({prf:ref}`lem-properties-regularized-std-dev-full`)\n4875:    - Z-score quotient rule ({prf:ref}`thm-cinf-regularity-zscore-full`)\n4876:    - Uniform bounds from non-vanishing denominator\n4877: \n4878: 5. **Part V (\u00a711-12)**: Final composition\n4879:    - Chain rule with Fa\u00e0 di Bruno formula ({prf:ref}`thm-main-cinf-regularity-fitness-potential-full`)\n4880:    - Gevrey-1 classification ({prf:ref}`cor-gevrey-1-fitness-potential-full`)\n4881:    - N-uniform and k-uniform bounds established",
      "metadata": {},
      "section": "## 13. Main Theorem: Complete Statement",
      "raw_directive": "4851: :::\n4852: \n4853: :::{prf:proof}\n4854: **Summary of proof architecture**:\n4855: \n4856: 1. **Part I (\u00a72-4)**: Smooth clustering framework\n4857:    - Partition of unity construction ({prf:ref}`const-mollified-partition-full`)\n4858:    - Exponential locality ({prf:ref}`lem-softmax-tail-corrected-full`)\n4859:    - Effective interactions ({prf:ref}`lem-effective-companion-count-corrected-full`)\n4860:    - Derivative bounds for $d_{\\text{alg}}$ ({prf:ref}`lem-dalg-derivative-bounds-full`)\n4861: \n4862: 2. **Part II (\u00a75-6)**: Localization weights\n4863:    - Gaussian kernel derivatives ({prf:ref}`lem-gaussian-kernel-derivatives-full`)\n4864:    - Quotient rule for weights ({prf:ref}`lem-localization-weight-derivatives-full`)\n4865:    - Telescoping identity ({prf:ref}`lem-telescoping-localization-weights-full`)\n4866:    - Companion coupling analysis ({prf:ref}`lem-derivatives-companion-distance-full`)\n4867: \n4868: 3. **Part III (\u00a77-8)**: Localized moments\n4869:    - Localized mean inductive bounds ({prf:ref}`lem-mth-derivative-localized-mean-full`)\n4870:    - Localized variance inductive bounds ({prf:ref}`thm-mth-derivative-localized-variance-full`)\n4871:    - k-uniformity via telescoping and exponential localization\n4872: \n4873: 4. **Part IV (\u00a79-10)**: Regularization and Z-score\n4874:    - Regularized std dev with positive lower bound ({prf:ref}`lem-properties-regularized-std-dev-full`)\n4875:    - Z-score quotient rule ({prf:ref}`thm-cinf-regularity-zscore-full`)\n4876:    - Uniform bounds from non-vanishing denominator\n4877: \n4878: 5. **Part V (\u00a711-12)**: Final composition\n4879:    - Chain rule with Fa\u00e0 di Bruno formula ({prf:ref}`thm-main-cinf-regularity-fitness-potential-full`)\n4880:    - Gevrey-1 classification ({prf:ref}`cor-gevrey-1-fitness-potential-full`)\n4881:    - N-uniform and k-uniform bounds established\n4882: "
    }
  ],
  "validation": {
    "ok": true,
    "errors": []
  }
}